CUST_CONCEPT_ID,CONCEPT_NAME,CONCEPT_NAME_KEY,CONCEPT_DESC,CONCEPT_TYPE_FLAG,CONCEPT_RELTN,EXPIRE_LOOKAHEAD,EXPIRE_ON_DISCHARGE,MULTIPLE_ENTRY_IND,UPDT_ID,UPDT_DT_TM,UPDT_CNT,UPDT_APPLCTX
382893952,Stop Bang High Risk,STOPBANGHIGHRISK,Patients with a documented stop bang high risk score,2,"{STOPBANGRISKSCORE}.count>0 and {STOPBANGRISKSCORE}.value=""High risk""",,0,0,27684549,  02/11/20,0,976058690
419010061,OIRD Very High Risk,OIRDVERYHIGHRISK,OIRD Monitoring Very High Risk Order placed on this encounter,1,,,1,0,29950371,  04/07/20,0,1228583269
431774020,Anticoag - Review Anticoagulant Duplicate Therapy,ANTICOAGREVIEWANTICOAGULANTDUPLICATETHERAPY,Patients with duplicate anticoagulant therapy orders that has been reviewed.,1,,"12,H",1,0,747930,  05/18/20,1,1378207953
431782627,Argatroban Order - Active,ARGATROBANORDERACTIVE,Patients with an active order for Argatroban,1,,,0,0,747930,  05/01/20,0,1314111759
431788903,ASP Timeout - Opt out daptomycin,ASPTIMEOUTOPTOUTDAPTOMYCIN,Patients with a documented reason for continuing daptomycin,1,,"12,H",1,0,28148754,  05/18/20,1,1379668471
431792678,Aztreonam IV Order,AZTREONAMIVORDER,Patients with an active order for IV aztreonam,1,,,1,0,747930,  05/01/20,0,1314111759
431808079,Dose Range Checking Violation,DOSERANGECHECKINGVIOLATION,Patients who have a DRC violation based on a change to a lab value,1,,,1,0,747930,  05/01/20,0,1314111759
431809879,Elevated WBC Count,ELEVATEDWBCCOUNT,Patient with a documented WBC > 15K in the last 24 hrs,1,,"24,H",1,0,747930,  05/01/20,0,1314111759
431816473,Fondaparinux Order - Discontinued,FONDAPARINUXORDERDISCONTINUED,Patients with a discontinued order for Fondaparinux in the last 72 hours,1,,"72,H",1,0,747930,  05/01/20,0,1314111759
431823797,Meropenem-vaborbactam IV Order,MEROPENEMVABORBACTAMIVORDER,Patients with an active order for IV meropenem-vaborbactam,1,,,1,0,747930,  05/01/20,0,1314111759
431835205,SRA Lab Value,SRALABVALUE,Patients with an SRA lab value during their current encounter as well as a reference to whether the value was positive or negative,1,,,1,0,747930,  05/01/20,0,1314111759
434221375,Anticoag - Just Rivaroxaban,ANTICOAGJUSTRIVAROXABAN,Patients with only a single anticoagulant order in an active or recently discontinued status - Rivaroxaban,2,{RIVAROXABANORDERACTIVE}.COUNT > 0 AND NOT {ANTICOAGMULTIMEDS} AND NOT {ANTICOAGSNOOZERIVAROXABAN},,0,0,28148754,  02/05/21,2,308545466
434224498,Anticoag - Positive ELISA OR SRA and Heparin Not Reviewed,ANTICOAGPOSITIVEELISAORSRAANDHEPARINNOTREVIEWED,Patients with an alert for a positive ELISA or SRA lab value and an active order or heparin which has not been reviewed in the last 24 hrs,2,{ANTICOAGPOSITIVEELISAORSRAANDHEPARIN} AND {ANTICOAGPOSITIVEELISAORSRAANDHEPARINREVIEW}.COUNT = 0,,0,0,747930,  05/07/20,0,1337441438
434225699,Anticoag - Supratherapeutic INR greater than 4 on warfarin,ANTICOAGSUPRATHERAPEUTICINRGREATERTHAN4ONWARFARIN,Patient has a most recent INR value greater than 4 AND they have an active warfarin order.,2,cnvtint({MOSTRECENTINRVALUE}.VALUE) > 4 AND {WARFARINORDERACTIVE}.COUNT > 0,,0,0,747930,  05/07/20,0,1337441438
434227204,IV Medication Orders - Only  Azithromycin,IVMEDICATIONORDERSONLYAZITHROMYCIN,Patients with only the single IV to PO conversion qualification of  - Azithromycin,2,NOT {IVMEDICATIONORDERSMULTI} AND {ANTIBIOTICGREATERTHAN48HOURSAZITHROMYCIN} AND {IVTOPOELIGABILITY},,0,0,747930,  05/07/20,0,1337441438
434227605,IV Medication Orders - Only Bactrim,IVMEDICATIONORDERSONLYBACTRIM,Patients with only the single IV to PO conversion qualification of  - Bactrim,2,NOT {IVMEDICATIONORDERSMULTI} AND {ANTIBIOTICGREATERTHAN48HOURSBACTRIM} AND {IVTOPOELIGABILITY},,0,0,747930,  05/07/20,0,1337441438
434228144,IV Medication Orders - Only Clindamycin,IVMEDICATIONORDERSONLYCLINDAMYCIN,Patients with only the single IV to PO conversion qualification of  - Clindamycin,2,NOT {IVMEDICATIONORDERSMULTI} AND {ANTIBIOTICGREATERTHAN48HOURSCLINDAMYCIN} AND {IVTOPOELIGABILITY},,0,0,747930,  05/07/20,0,1337441438
434228363,IV Medication Orders - Only Doxycycline,IVMEDICATIONORDERSONLYDOXYCYCLINE,Patients with only the single IV to PO conversion qualification of  - Doxycycline,2,NOT {IVMEDICATIONORDERSMULTI} AND {ANTIBIOTICGREATERTHAN48HOURSDOXYCYCLINE} AND {IVTOPOELIGABILITY},,0,0,747930,  05/07/20,0,1337441438
434228566,IV Medication Orders - Only Famotidine,IVMEDICATIONORDERSONLYFAMOTIDINE,Patients with only the single IV to PO conversion qualification of  - Famotidine,2,NOT {IVMEDICATIONORDERSMULTI} AND {FAMOTIDINEIVORDER}.COUNT > 0 AND {IVTOPOELIGABILITY},,0,0,747930,  05/07/20,0,1337441438
434228778,IV Medication Orders - Only  Fluconazole,IVMEDICATIONORDERSONLYFLUCONAZOLE,Patients with only the single IV to PO conversion qualification of  - Fluconazole,2,NOT {IVMEDICATIONORDERSMULTI} AND {ANTIBIOTICGREATERTHAN48HOURSFLUCONAXOLE} AND {IVTOPOELIGABILITY},,0,0,747930,  05/07/20,0,1337441438
434228974,IV Medication Orders - Only Folic Acid,IVMEDICATIONORDERSONLYFOLICACID,Patients with only the single IV to PO conversion qualification of  -  Folic Acid,2,NOT {IVMEDICATIONORDERSMULTI} AND {FOLICACIDIVORDER}.COUNT > 0 AND {IVTOPOELIGABILITY},,0,0,747930,  05/07/20,0,1337441438
434229242,IV Medication Orders - Only Ibuprofen,IVMEDICATIONORDERSONLYIBUPROFEN,Patients with only the single IV to PO conversion qualification of  - Ibuprofen,2,NOT {IVMEDICATIONORDERSMULTI} AND {IBUPROFENIVORDER}.COUNT > 0 AND {IVTOPOELIGABILITY},,0,0,747930,  05/07/20,0,1337441438
434229544,IV Medication Orders - Only  Levofloxacin,IVMEDICATIONORDERSONLYLEVOFLOXACIN,Patients with only the single IV to PO conversion qualification of  - Levofloxacin,2,NOT {IVMEDICATIONORDERSMULTI} AND {ANTIBIOTICGREATERTHAN48HOURSLEVOFLOXACIN} AND {IVTOPOELIGABILITY},,0,0,747930,  05/07/20,0,1337441438
340972322,Documentation of Fetal Distress Delivered without Dx,DOCUMENTATIONOFFETALDISTRESSDELIVEREDWITHOUTDX,An encounter with documentation supporting Fetal distress with delivery without a diagnosis.,2,{FETALDISTRESSDELIVERED}.count > 0 AND {FETALDISTRESSDELIVEREDREJECTED}.count = 0 AND {FETALDISTRESSDELIVEREDDX}.count = 0,,0,0,30365432,  12/12/19,0,683056388
340974647,Documentation of Obstetrical Trauma with Delivery without Dx,DOCUMENTATIONOFOBSTETRICALTRAUMAWITHDELIVERYWITHOUTDX,An encounter with documentation supporting Obstetrical Trauma with Delivery without a diagnosis.,2,({OBSTETRICALTRAUMAWITHDELIVERY}.count > 0 OR ({THIRDDEGREEPERINEALLACERATION}.count > 0 OR {FOURTHDEGREEPERINEALLACERATION}.count > 0)) AND {OBSTETRICALTRAUMAWITHDELIVERYREJECTED}.count = 0 AND {OBSTETRICALTRAUMAWITHDELIVERYDX}.count = 0,,0,0,30365432,  02/03/20,1,937083934
346894233,PRETERMDELIVERY,PRETERMDELIVERY,an encounter with a preterm delivery,1,,,1,0,31904138,  12/20/19,0,726260081
357859097,Documented PU - Stage II Atomic,DOCUMENTEDPUSTAGEIIATOMIC,Atomic concept for encounters with a documented pressure ulcer of stage II,1,,,1,1,30025061,  01/07/20,1,802380954
363745583,QM P2Y12 Inhib Prescribed,QMP2Y12INHIBPRESCRIBED,"Encounters with a prescription for one of the P2Y12 class of drugs (Ticagrelor, Prasugrel, Clopidogrel)",1,,,1,0,23353630,  01/15/20,0,843295419
402792039,Planned Labor Induction,PLANNEDLABORINDUCTION,Patients with a reason for visit of induction documented OR ‘Induction and Cervical Ripening’ is documented as Yes in the OB Hemorrhage Risk Assessment.,1,,,1,0,30025061,  03/10/20,0,1115078024
411768785,COVID-19 Order Completed,COVID19ORDERCOMPLETED,Patients with an order for COVID-19 Testing that has been completed,1,,,1,0,26977162,  03/24/20,0,1178742394
419009781,OIRD High Risk,OIRDHIGHRISK,OIRD Monitoring High Risk Order placed on this encounter,1,,,1,0,29950371,  04/07/20,0,1228583269
431763470,Acetaminophen IV Order,ACETAMINOPHENIVORDER,Patients with an active order for IV Acetaminophen,1,,,1,0,747930,  05/01/20,0,1314111759
431765896,ANC Lab Result,ANCLABRESULT,Patients with an ANC lab result in their current encounter and a reference to the value of the most recent ANC result,1,,,1,0,747930,  05/01/20,0,1314111759
431766032,Anticoag - Decrease in hemoglobin,ANTICOAGDECREASEINHEMOGLOBIN,Patients with a hemoglobin decrease of 2 or more g/dL in a 24 hr period,1,,,1,0,747930,  05/01/20,0,1314111759
431766697,Anticoag - Increased INR,ANTICOAGINCREASEDINR,Patients with a grater than .5 increase in INR over 24hrs,1,,,1,0,747930,  05/01/20,0,1314111759
431772709,Anticoag - Positive ELISA OR SRA and Heparin Review,ANTICOAGPOSITIVEELISAORSRAANDHEPARINREVIEW,Patients with a documented review in the last 24 hours for a Positive ELISA OR SRA and Heparin alert,1,,"12,H",1,0,747930,  05/18/20,1,1378207953
431775119,Anticoag - Review Decrease in Hgb/Hct,ANTICOAGREVIEWDECREASEINHGBHCT,Patients with a decrease in Hgb/Hct that has been reviewed.,1,,"12,H",1,0,747930,  05/18/20,1,1378207953
431775470,Anticoag - Review Decreasing Platelet,ANTICOAGREVIEWDECREASINGPLATELET,Patients who have a documented review of their decreasing platelet count while on an anticoagulant,1,,"12,H",1,0,747930,  05/18/20,1,1378207953
431778090,Anticoag - Review Supratherapeutic INR,ANTICOAGREVIEWSUPRATHERAPEUTICINR,Patients with a documented review for a Supratherapeutic INR while on anticoagulant.,1,,"12,H",1,0,747930,  05/18/20,1,1378207953
431784143,ASP Timeout - Opt out ceftaz-avibactam,ASPTIMEOUTOPTOUTCEFTAZAVIBACTAM,Patients with a documented reason for continuing ceftazidime-avibactam,1,,"12,H",1,0,28148754,  05/18/20,1,1379668471
431784572,ASP Timeout - Opt out ceftazidime,ASPTIMEOUTOPTOUTCEFTAZIDIME,Patients with a documented reason for continuing ceftazidime,1,,"12,H",1,0,28148754,  05/18/20,1,1379668471
431788634,ASP Timeout - Opt out clindamycin,ASPTIMEOUTOPTOUTCLINDAMYCIN,Patients with a documented reason for continuing clindamycin,1,,"12,H",1,0,28148754,  05/18/20,1,1379668471
431789827,ASP Timeout - Opt out linezolid,ASPTIMEOUTOPTOUTLINEZOLID,Patients with a documented reason for continuing linezolid,1,,"12,H",1,0,28148754,  05/18/20,1,1379668471
431790489,ASP Timeout - Opt out vancomycin,ASPTIMEOUTOPTOUTVANCOMYCIN,Patients with a documented reason for continuing vancomycin,1,,"12,H",1,0,28148754,  05/18/20,1,1379668471
431792161,Azithromycin IV order,AZITHROMYCINIVORDER,Patients with an active order for IV Azithromycin,1,,,1,0,747930,  05/01/20,0,1314111759
431793189,Bactrim IV Order,BACTRIMIVORDER,Patients with an active order for IV Bactrim,1,,,1,0,747930,  05/01/20,0,1314111759
431804777,Cefepime IV Order,CEFEPIMEIVORDER,Patients with an active order for IV cefepime,1,,,1,0,747930,  05/01/20,0,1314111759
431805127,Ceftazidime-avibactam IV Order,CEFTAZIDIMEAVIBACTAMIVORDER,Patients with an active order for IV ceftazidime-avibactam,1,,,1,0,747930,  05/01/20,0,1314111759
431806158,Clopidogrel Order - Active,CLOPIDOGRELORDERACTIVE,Patients with an active order for Clopidogrel,1,,,1,0,747930,  05/01/20,0,1314111759
431806940,Dabigatran Order - Discontinued,DABIGATRANORDERDISCONTINUED,Patients with a discontinued order for Dabigatran in the past 48 hours,1,,"48,H",1,0,747930,  05/01/20,0,1314111759
431807361,Dobutamine IV Order,DOBUTAMINEIVORDER,Patients with an active order for IV Dobutamine,1,,,1,0,747930,  05/01/20,0,1314111759
431808431,Doxycycline IV Order,DOXYCYCLINEIVORDER,Patients with an active order for IV Doxycycline,1,,,1,0,747930,  05/01/20,0,1314111759
431809664,Elevated Resp Rate,ELEVATEDRESPRATE,Patient with a documented Respiratory Rate > 20 in the last 24 hrs,1,,"24,H",1,0,747930,  05/01/20,0,1314111759
431810856,Enoxaparin - Active Theraputic Order,ENOXAPARINACTIVETHERAPUTICORDER,Patients with an active order for enoxaparin with a theraputic dose,1,,,1,0,747930,  05/01/20,0,1314111759
431812166,Eptifibatide Order - Active,EPTIFIBATIDEORDERACTIVE,Patients with an active order for Eptifibatide,1,,,1,0,747930,  05/01/20,0,1314111759
431812804,Famotidine IV Order,FAMOTIDINEIVORDER,Patients with an active order for IV Famotidine,1,,,1,0,747930,  05/01/20,0,1314111759
431816949,Heparin Order (non-SubQ) - Discontinued,HEPARINORDERNONSUBQDISCONTINUED,Patients with a discontinued heparin order that is not a subcutaneous route in the past 12 hours,1,,"12,H",1,0,747930,  05/01/20,0,1314111759
431819585,Levofloxacin IV Order,LEVOFLOXACINIVORDER,Patients with an active order for IV Levofloxacin,1,,,1,0,747930,  05/01/20,0,1314111759
431822068,Linezolid IV Order,LINEZOLIDIVORDER,Patients with an active order for IV Linezolid,1,,,1,0,747930,  05/01/20,0,1314111759
431822735,Malabsorption Dx,MALABSORPTIONDX,Patients with an active diagnosis of malabsorption,1,,,1,0,747930,  05/01/20,0,1314111759
431826132,Metoclopramide IV Order,METOCLOPRAMIDEIVORDER,Patients with an active order for IV Metoclopramide,1,,,1,0,747930,  05/01/20,0,1314111759
431828769,Metronidazole IV Order,METRONIDAZOLEIVORDER,Patients with an active order for IV Metronidazole,1,,,1,0,747930,  05/01/20,0,1314111759
431829659,Most Recent INR Value,MOSTRECENTINRVALUE,Patient's most recent INR value on this encounter,1,,,1,0,747930,  05/01/20,0,1314111759
431831993,Multivitamin IV Order,MULTIVITAMINIVORDER,Patients with an active order for IV Multivitamin,1,,,1,0,747930,  05/01/20,0,1314111759
339519991,TELE - Temporarily disconnected,TELETEMPORARILYDISCONNECTED,Patients with most recent Cardiac Monitor Activity documentation = 'Temporarily Disconnected',1,,,1,0,23353630,  12/10/19,0,672823980
340959494,Documentation of Shoulder Dystocia LD without Dx,DOCUMENTATIONOFSHOULDERDYSTOCIALDWITHOUTDX,An encounter with a  documentation supporting shoulder dystocia during labor and delivery without a diagnosis,2,{SHOULDERDYSTOCIALD}.COUNT > 0 AND {SHOULDERDYSTOCIALDREJECTED}.COUNT = 0 AND {SHOULDERDYSTOCIALDDX}.COUNT = 0,,0,0,30365432,  12/12/19,0,683056388
340965165,Forceps Delivery Rejected,FORCEPSDELIVERYREJECTED,An encounter with a REJECTED diagnosis of Forceps Delivery.,1,,,1,0,30365432,  12/12/19,0,683056388
340973927,Obstetrical Trauma with Delivery Rejected,OBSTETRICALTRAUMAWITHDELIVERYREJECTED,An encounter with a REJECTED diagnosis of Obstetrical Trauma with Delivery.,1,,,1,0,30365432,  12/12/19,0,683056388
411769367,COVID-19 Positive Result,COVID19POSITIVERESULT,Patients with a positive result for COVID-19 Testing,1,,,1,0,26977162,  03/24/20,0,1178742394
422054948,Admission History Status,ADMISSIONHISTORYSTATUS,An encounter with an admission history powerform completed.,1,,,1,0,30365432,  04/13/20,0,1249011854
422062040,ID Risk Screen,IDRISKSCREEN,An encounter that requires the ID Risk Screening.,1,,,1,0,30365432,  04/13/20,0,1249148602
431762341,Abciximab Order - Active,ABCIXIMABORDERACTIVE,Patients with an active order for Abciximab,1,,,1,0,747930,  05/01/20,1,1314111759
431772246,Anticoag - Negative ELISA OR SRA and Argatroban Review,ANTICOAGNEGATIVEELISAORSRAANDARGATROBANREVIEW,Patients with a documented review iin the last 24 hours for a Negative ELISA OR SRA and Argatroban alert,1,,"12,H",1,0,747930,  05/18/20,1,1378207953
431774716,Anticoag - Review Dabigatran,ANTICOAGREVIEWDABIGATRAN,Patients with a dabigatran order that has been reviewed,1,,"12,H",1,0,747930,  05/18/20,1,1378207953
431775876,Anticoag - Review Epidural and Anticoagulant order,ANTICOAGREVIEWEPIDURALANDANTICOAGULANTORDER,Patients with an epidural and anticoagulant order that has been reviewed.,1,,"12,H",1,0,747930,  05/18/20,1,1378207953
431776118,Anticoag - Review Fondaparinux,ANTICOAGREVIEWFONDAPARINUX,Patients with a fondaparinux order that has been reviewed,1,,"12,H",1,0,747930,  05/18/20,1,1378207953
431776381,Anticoag - Review Heparin,ANTICOAGREVIEWHEPARIN,Patients with a heparin order that has been reviewed,1,,"12,H",1,0,747930,  05/18/20,1,1378207953
431777521,Anticoag - Review INR Increase,ANTICOAGREVIEWINRINCREASE,Patients who have had a significant increae in INR on Warfarin reviewed,1,,"12,H",1,0,747930,  05/18/20,1,1378207953
431777709,Anticoag - Review Low Platelet,ANTICOAGREVIEWLOWPLATELET,Patients who have a documented review of their low platelet count while on an anticoagulant,1,,"12,H",1,0,747930,  05/18/20,1,1378207953
431777873,Anticoag - Review Rivaroxaban,ANTICOAGREVIEWRIVAROXABAN,Patients with a rivaroxaban order that has been reviewed,1,,"12,H",1,0,747930,  05/18/20,1,1378207953
431778367,Anticoag - Review Supratherapeutic INR on Warfarin,ANTICOAGREVIEWSUPRATHERAPEUTICINRONWARFARIN,Patients with a documented review for a Supratherapeutic INR while on Warfarin,1,,"12,H",1,0,28148754,  05/18/20,1,1379668471
431783327,Aspirin Order - Non Prophylactic Dose,ASPIRINORDERNONPROPHYLACTICDOSE,Patients with an active order for aspirin with a dose greater than 81mg during their current encounter,1,,,1,0,747930,  05/01/20,0,1314111759
431789600,ASP Timeout - Opt out levofloxacin,ASPTIMEOUTOPTOUTLEVOFLOXACIN,Patients with a documented reason for continuing levofloxacan,1,,"12,H",1,0,28148754,  05/18/20,1,1379668471
431805708,Ciprofloxacin IV Order,CIPROFLOXACINIVORDER,Patients with an active order for IV Ciprofloxacin,1,,,1,0,747930,  05/01/20,0,1314111759
431821922,Levothyroxine IV Order,LEVOTHYROXINEIVORDER,Patients with an active order for IV Levothyroxine,1,,,1,0,747930,  05/01/20,0,1314111759
431823141,Meningitis Dx,MENINGITISDX,Patients with an active diagnosis of meningitis,1,,,1,0,747930,  05/01/20,0,1314111759
431832851,Norepinephrine IV Order,NOREPINEPHRINEIVORDER,Patients with an active order for IV Norepinephrine,1,,,1,0,747930,  05/01/20,0,1314111759
431834025,Rifampin IV Order,RIFAMPINIVORDER,Patients with an active order for IV Rifampin,1,,,1,0,747930,  05/01/20,0,1314111759
431834689,Rivaroxaban Order - Active,RIVAROXABANORDERACTIVE,Patients with an active order for Rivaroxaban,1,,,1,0,747930,  05/01/20,0,1314111759
431835916,Vancomycin IV Order,VANCOMYCINIVORDER,Patients with an active order for IV vancomycin,1,,,1,0,747930,  05/01/20,0,1314111759
431836462,Warfarin Order - Active,WARFARINORDERACTIVE,Patients with an active order for Warfarin,1,,,1,0,747930,  05/01/20,0,1314111759
434219273,Anticoag - Hemoglobin Contraindications Not Reviewed,ANTICOAGHEMOGLOBINCONTRAINDICATIONSNOTREVIEWED,Patients with a contraindication to anticoagulants based on a decrease in hemoglobin levels,2,{ANTICOAGDECREASEINHEMOGLOBINCONTRAINDICATIONS} AND NOT {ANTICOAGREVIEWDECREASEINHGBHCT}.COUNT > 0,,0,0,747930,  05/07/20,0,1337368498
434219714,Anticoag - Increased INR on warfarin,ANTICOAGINCREASEDINRONWARFARIN,Patients with an increase in INR by 0.5 or more in a 24 hr period while actively on warfarin.,2,{ANTICOAGINCREASEDINR}.COUNT > 0 AND {ANTICOAGWARFARINACTIVEORDC} AND {ANTICOAGREVIEWINRINCREASE}.COUNT = 0,,0,0,28148754,  03/17/21,2,527401056
434221132,Anticoag - Just Non SubQ Heparin,ANTICOAGJUSTNONSUBQHEPARIN,Patients with only a single anticoagulant order in an active or recently discontinued status - Non SubQ Heparin,2,{HEPARINORDERNONSUBQACTIVE}.COUNT > 0 AND NOT {ANTICOAGMULTIMEDS} AND NOT {ANTICOAGSNOOZEHEPARIN},,0,0,28148754,  02/05/21,2,308545466
434222017,Anticoag - multi meds,ANTICOAGMULTIMEDS,Patients with more than 1 unique anticoagulant in either an active or recently discontinued status,2,evaluate2(if({RIVAROXABANORDERACTIVE}.COUNT > 0 AND NOT {ANTICOAGSNOOZERIVAROXABAN}) 1 else 0 endif) + evaluate2(if({WARFARINORDERACTIVE}.COUNT > 0 AND NOT {ANTICOAGSNOOZEWARFARIN}) 1 else 0 endif) + evaluate2(if({HEPARINORDERNONSUBQACTIVE}.COUNT > 0 AND NOT {ANTICOAGSNOOZEHEPARIN}) 1 else 0 endif) + evaluate2(if({FONDAPARINUXORDERACTIVE}.COUNT > 0 AND NOT {ANTICOAGSNOOZEFONDAPARINUX}) 1 else 0 endif) + evaluate2(if({ENOXAPARINACTIVETHERAPUTICORDER}.COUNT > 0 AND NOT {ANTICOAGSNOOZEENOXAPARIN}) 1 else 0 endif) + evaluate2(if({DABIGATRANORDERACTIVE}.COUNT > 0 AND NOT {ANTICOAGSNOOZEDABIGATRAN}) 1 else 0 endif) + evaluate2(if({ARGATROBANORDERACTIVE}.COUNT > 0 AND NOT {ANTICOAGSNOOZEARGATROBAN}) 1 else 0 endif) + evaluate2(if({APIXABANORDERACTIVE}.COUNT > 0 AND NOT {ANTICOAGSNOOZEAPIXABAN}) 1 else 0 endif) + evaluate2(if({ENOXAPARINORDERPROPHYLACTICACTIVE}.COUNT > 0 AND NOT {ANTICOAGSNOOZEPROPHYLACTICENOXAPARIN}) 1 else 0 endif) > 1,,0,0,30825554,  05/09/23,4,471968341
434222821,Anticoag - Negative ELISA OR SRA and Argatroban Not Reviewed,ANTICOAGNEGATIVEELISAORSRAANDARGATROBANNOTREVIEWED,Patients with an alert for negative ELISA or SRA lab value and an active order or argatroban which has not been reviewed in the last 24 hrs,2,{ANTICOAGNEGATIVEELISAORSRAANDARGATROBAN} AND {ANTICOAGNEGATIVEELISAORSRAANDARGATROBANREVIEW}.COUNT = 0,,0,0,747930,  05/07/20,0,1337368498
339436230,Order Entry Details Documented,ORDERENTRYDETAILSDOCUMENTED,"Patients that have ""Order Entry Details"" powerform signed",1,,,1,0,27748885,  12/10/19,0,672133345
339520523,TELE - Protocol Indication Time Expired,TELEPROTOCOLINDICATIONTIMEEXPIRED,The start date time of this concept represents the date time the indication time expires which coincides with the start date time of the assesssment order.,1,,,1,0,38215707,  06/13/23,1,557349313
340953832,Shoulder Dystocia LD Rejected,SHOULDERDYSTOCIALDREJECTED,An encounter with a REJECTED diagnosis of shoulder dystocia during labor and delivery diagnosis.,1,,,1,0,30365432,  12/12/19,0,683056388
340971139,Fetal Distress Delivered Dx,FETALDISTRESSDELIVEREDDX,An encounter with a diagnosis of Fetal Distress Delivery.,1,,,1,0,30365432,  12/12/19,0,683056388
340987352,Third Degree Perineal Laceration,THIRDDEGREEPERINEALLACERATION,An encounter with documentation supporting a Third Degree Perineal Laceration  .,1,,,1,0,30365432,  12/12/19,1,683056388
357802376,QM - TIMI Score,QMTIMISCORE,Encounters who have at least 1 TIMI score documentation,1,,,1,0,27748885,  01/07/20,0,802244711
363744838,QM P2Y12 Inhib Contraindicated,QMP2Y12INHIBCONTRAINDICATED,"Encounters with a documented contraindication to the P2Y12 class of drugs (Ticagrelor, Prasugrel, Clopidogrel)",1,,,1,0,23353630,  01/15/20,0,843295419
363745313,QM P2Y12 Inhib Home Med,QMP2Y12INHIBHOMEMED,"Encounters with a documented home med of one of the P2Y12 class of drugs (Ticagrelor, Prasugrel, Clopidogrel)",1,,,1,0,23353630,  01/15/20,0,843295419
392988916,Current Encounter Abuse Documented,CURRENTENCOUNTERABUSEDOCUMENTED,Abuse documented on the current encounter.  ED Triage Abuse/Neglect powerform.,1,,,1,0,31551005,  02/25/20,0,1045602499
411768521,COVID-19 Order,COVID19ORDER,Patients with an active order for COVID-19 Testing,1,,,1,0,26977162,  03/24/20,0,1178742394
411770988,COVID-19 Order Completed or Pos Doc,COVID19ORDERCOMPLETEDORPOSDOC,Patients with an order for COVID-19 Testing that has been completed or documentation has occured of a positive.,2,{COVID19ORDERCOMPLETED}.COUNT > 0 OR {COVID19POSITIVE},,0,0,26977162,  03/24/20,0,1178742394
411771247,COVID-19 Order and No Result or Doc,COVID19ORDERANDNORESULTORDOC,Patients with an active order or suspected from testing at other facility/site and no result or documentation of a positive.  Also accounts for new orders after documentation or previous negative.,2,({COVID19ORDER}.COUNT > 0 AND NOT {COVID19POSITIVE}) OR ({COVID19IPDOCUMENTATIONOFSUSPECTED}.COUNT > 0 AND NOT({COVID19ORDERCOMPLETED}.COUNT > 0 OR {COVID19ORDER}.COUNT > 0 OR {COVID19POSITIVE} OR {COVID19NEGATIVE})),,0,0,26977162,  05/05/20,3,1327672377
413054497,Fetal Macrosomia Rejected,FETALMACROSOMIAREJECTED,Rejected suggested diagnosis of Fetal Macrosomia,1,,,1,0,30365432,  03/26/20,0,1188190194
419724791,Bundle Payment Program,BUNDLEPAYMENTPROGRAM,"Patients that are in a Bundle Payment program (BPCIA) as indicated by the existance of the clinical event ""BP Episode Start Date/Time"" which is populated via HL7 from Remedy",1,,,1,0,26807360,  04/08/20,0,1233522313
431774483,Anticoag - Review Argatroban,ANTICOAGREVIEWARGATROBAN,Patients with an argatroban order that has been reviewed,1,,"12,H",1,0,747930,  05/18/20,1,1378207953
431781632,Apixaban Order - Active,APIXABANORDERACTIVE,Patients with an active order for Apixaban,1,,,1,0,747930,  05/01/20,0,1314111759
431788337,ASP Timeout - Opt out ciprofloxacin,ASPTIMEOUTOPTOUTCIPROFLOXACIN,Patients with a documented reason for continuing ciprofloxacin,1,,"12,H",1,0,28148754,  05/18/20,1,1379668471
431790723,ASP Timeout - Opt out zosyn,ASPTIMEOUTOPTOUTZOSYN,Patients with a documented reason for continuing zosyn,1,,"12,H",1,0,28148754,  05/18/20,1,1379668471
431793542,Bivalirudin Order - Active,BIVALIRUDINORDERACTIVE,Patients with an active order for Bivalirudin,1,,,1,0,747930,  05/01/20,0,1314111759
431807759,Dopamine IV Order,DOPAMINEIVORDER,Patients with an active order for IV Dopamine,1,,,1,0,747930,  05/01/20,0,1314111759
431809358,Elevated Heart Rate,ELEVATEDHEARTRATE,Patients with a documented Heart Rate > 90 in the last 24 hours,1,,"24,H",1,0,747930,  05/01/20,0,1314111759
431811655,Epidural Medication,EPIDURALMEDICATION,Patients with an active medication order with an epidural route of administration,1,,,1,0,747930,  05/01/20,0,1314111759
431815638,Fluconaxole IV Order,FLUCONAXOLEIVORDER,Patients with an active order for IV Fluconaxole,1,,,1,0,747930,  05/01/20,0,1314111759
431816153,Fondaparinux Order - Active,FONDAPARINUXORDERACTIVE,Patients with an active order for Fondaparinux,1,,,1,0,747930,  05/01/20,0,1314111759
431829786,Moxifloxacin IV Order,MOXIFLOXACINIVORDER,Patients with an active order for IV Moxifloxacin,1,,,1,0,747930,  05/01/20,0,1314111759
431832998,Osteomyelitis Dx,OSTEOMYELITISDX,Patients with an active diagnosis of osteomyelitis,1,,,1,0,747930,  05/01/20,0,1314111759
431833748,Prasugrel Order - Active,PRASUGRELORDERACTIVE,Patients with an active order for Prasugrel,1,,,1,0,747930,  05/01/20,0,1314111759
