CUST_CONCEPT_ID,CONCEPT_NAME,CONCEPT_NAME_KEY,CONCEPT_DESC,CONCEPT_TYPE_FLAG,CONCEPT_RELTN,EXPIRE_LOOKAHEAD,EXPIRE_ON_DISCHARGE,MULTIPLE_ENTRY_IND,UPDT_ID,UPDT_DT_TM,UPDT_CNT,UPDT_APPLCTX
19187225,QM - Anticoagulation Home Med,QMANTICOAGULATIONHOMEMED,Patients who have an Anticoagulant as a home med on this encounter.,1,,,0,0,23353630,  06/06/16,0,1016050929
19497928,QM - SEP Clinical Sepsis Alert Active,QMSEPCLINICALSEPSISALERTACTIVE,Patients who have an active manual clinically indicated sepsis alert triggered.,1,,,1,0,23353630,  06/13/16,0,1029483627
19499852,QM - SEP Severe Sepsis Diagnosis,QMSEPSEVERESEPSISDIAGNOSIS,Patients with a severe sepsis related ICD-10-CM diagnosis,1,,,1,0,23353630,  06/13/16,0,1029582607
28467387,Glucose Level- Historical and Current,GLUCOSELEVELHISTORICALANDCURRENT,Patient with a glucose result on current encounter or historical encounter,1,,"3,M",0,0,26977162,  10/27/16,0,1295654379
28467500,Lipid Panel,LIPIDPANEL,"Patients with a Triglyceride, Total Cholesterol, HDL, LDL result or Lipid Panel Order on Current Encounter or result from Historical Encounter (Time Frame Defined in Atomic Concept)",2,{LIPIDPANELORDER}.COUNT>0 OR {LIPIDPANELHISTORICALANDCURRENT}.COUNT>0,,0,0,26977162,  10/27/16,0,1295654379
28467602,QM - Metabolic Screening,QMMETABOLICSCREENING,"Patients who qualify for Metabolic Screening by meeting criteria: Order for Antipsychotic, Order for HBIPS QM (Inpatient Psych Pt) and No active order for Glucose Level",2,({QMANTIPSYCHOTICINPATIENT}.COUNT > 0 OR {QMANTIPSYCHOTICPRESCRIPTION}.COUNT > 0) AND {QMHBIPSQUALITYMEASURE}.COUNT > 0 AND {QMMETABOLICSCREENINGQUALIFICATION}.COUNT > 0,,0,0,26977162,  03/13/18,1,241811624
28870002,Anticipated Discharge Dispositon,ANTICIPATEDDISCHARGEDISPOSITON,Patients with a documented anticipated discharge disposition,1,,,1,0,747930,  11/02/16,0,1307477390
31564650,QM - SUB3 Quality Measure,QMSUB3QUALITYMEASURE,Patients that qualify for SUB 3 Measure (Diagnosis of Alcohol or Drug Dependence),2,{QMSUBALCOHOLORDRUGDEPENDENCEDIAGNOSIS}.COUNT>0 AND {QMHBIPSQUALITYMEASURE}.COUNT>0 AND {QMSUBQUALITYMEASURE}.COUNT>0,,0,0,26977162,  03/13/18,1,241811624
33455992,Pending Radiology Orders,PENDINGRADIOLOGYORDERS,Patients with a radiology order that is in an ordered status and has not been read,1,,,1,0,27684549,  01/10/17,0,1440621355
60333508,IMM - Influenza Vaccine Assessment Satisfied,IMMINFLUENZAVACCINEASSESSMENTSATISFIED,Patients who do not require assessment for the Influenza Vaccine.,2,"({IMMINFLUENZAVACCINEASSESSMENT}.count > 0 AND {IMMINFLUENZAVACCINEASSESSMENT}.value = ""GOOD"")  OR NOT{IMMFLUSEASON} OR {IMMAGELESSTHANSIXMONTHS}.count = 1",,0,0,23353630,  08/28/17,0,1924896055
62113427,Documentation of Restraints and No End Shift Attestation,DOCUMENTATIONOFRESTRAINTSANDNOENDSHIFTATTESTATION,Patients with documentation of active non violent restraints and no End Shift Attestation within the last 13 hours,2,{DOCUMENTATIONOFRESTRAINTSNONVIOLENT}.COUNT > 0 AND {RESTRAINTSHIFTDOCUMENTATION}.COUNT = 0,,0,0,747930,  09/06/17,0,1945010165
64179217,No Admission Order,NOADMISSIONORDER,Patients without an active AOT order,2,{ADMISSIONORDER}.COUNT = 0,,0,0,26807360,  09/21/17,0,1976939298
64179360,No Resuscitation Status,NORESUSCITATIONSTATUS,Patients without an order for Resuscitation Status,2,{RESUSCITATIONSTATUS}.COUNT = 0 AND  {ENCOUNTERTYPENOTAMBULATORYORBH},,0,0,30365432,  05/11/23,1,478067163
64179442,No Patient Preferred Pharmacy,NOPATIENTPREFERREDPHARMACY,Patients without a documented preferred pharmacy,2,{PATIENTPREFERREDPHARMACY}.COUNT = 0,,0,0,26807360,  09/21/17,0,1976939298
91569309,Non-invasive Vents with No Dressing,NONINVASIVEVENTSWITHNODRESSING,Patients with a non-invasive vent and no documentation of dressing application or change in the last 13 hours.,2,{NONINVASIVEVENTDRESSING}.COUNT = 0 AND {NONINVASIVEVENTS}.COUNT > 0,,0,0,30025061,  03/13/18,0,242336877
94985233,Midline Documentation,MIDLINEDOCUMENTATION,Patients that have documentation of a Midline,1,,,1,1,28977274,  01/20/21,1,293345195
108203489,DME Rx Order,DMERXORDER,Patients with a prescription DME order,1,,,1,0,27684549,  06/18/18,0,525889096
108204002,Pending DC and Pending Provider Consults,PENDINGDCANDPENDINGPROVIDERCONSULTS,Patients that are pending discharge and have pending provider consult orders,2,{PENDINGDISCHARGE}.COUNT > 0 AND {PENDINGPROVIDERCONSULTS}.COUNT > 0,,0,0,27684549,  06/18/18,0,525889096
108204022,Pending DC and Pending Vaccines,PENDINGDCANDPENDINGVACCINES,Patients that are pending discharge and have pending vaccines (in concept),2,{PENDINGDISCHARGE}.COUNT > 0 AND {PENDINGVACCINES},,0,0,27684549,  06/18/18,0,525889096
108205210,Nursing DC Paperwork Complete,NURSINGDCPAPERWORKCOMPLETE,Patients that have a completed Patient Summary and Clinical Summary,2,{PATIENTSUMMARYCOMPLETE}.COUNT > 0 AND {CLINICALSUMMARYCOMPLETE}.COUNT > 0,,0,0,26807360,  06/27/18,1,553692567
117866242,Admission History Newborn NICU,ADMISSIONHISTORYNEWBORNNICU,Status of Admission History Newborn NICU order,1,,,1,0,26807360,  08/13/18,0,727763123
117866760,BH Admission Assessment Peds,BHADMISSIONASSESSMENTPEDS,Status of BH Admission Assessment Peds order,1,,,1,0,26807360,  08/13/18,0,727763123
117866934,BH Admission Assessment Peds Complete,BHADMISSIONASSESSMENTPEDSCOMPLETE,Status of BH Admission Assessment Peds order = Completed,1,,,1,0,26807360,  08/14/18,1,730815431
117868102,OB Admission History,OBADMISSIONHISTORY,Status of OB Admission History-PCM order,1,,,1,0,26807360,  08/13/18,0,727763123
118050151,Pressure Ulcer DX Rejected,PRESSUREULCERDXREJECTED,Rejected Pressure Ulcer Diagnoses,1,,,0,0,30365432,  08/14/18,0,730866889
118050714,Documentation of Pressure Ulcer without Dx,DOCUMENTATIONOFPRESSUREULCERWITHOUTDX,Documentation of a pressure ulcer and no documentation of rejection.,2,{WOUNDSPRESENTONADMISSION}.count > 0 AND {PRESSUREULCERDXREJECTED}.count = 0 AND {PRESSUREULCERDIAGNOSIS}.count = 0,,0,0,30365432,  08/14/18,1,730866889
118051767,Admission Assessment Triggered,ADMISSIONASSESSMENTTRIGGERED,Status of Admission Assessment order = ordered complete,2,({ADMISSIONASSESSMENT}.count + {ADMISSIONASSESSMENTCOMPLETE}.count) > 0,,0,0,26807360,  08/14/18,0,730815431
118055855,Unable to obtain - History of tobacco use in last 30 days,UNABLETOOBTAINHISTORYOFTOBACCOUSEINLAST30DAYS,Unable to obtain select on Adult Admission Assessment on History of tobacco use,1,,,1,0,29858000,  08/14/18,0,730979301
118055993,Unable to obtain - Patient/Family education needs,UNABLETOOBTAINPATIENTFAMILYEDUCATIONNEEDS,Unable to obtain select on Adult Admission Assessment on Patient/Family education needs,1,,,1,0,29858000,  08/14/18,0,730979301
118056258,Unable to obtain - Reported history or evidence or abuse/neglect,UNABLETOOBTAINREPORTEDHISTORYOREVIDENCEORABUSENEGLECT,Unable to obtain select on Adult Admission Assessment on Reported history or evidence of abuse/neglect,1,,,1,0,29858000,  08/14/18,0,730979301
118056371,Unable to obtain - Spiritual practices,UNABLETOOBTAINSPIRITUALPRACTICES,Unable to obtain select on Adult Admission Assessment on Spiritual practices,1,,,1,0,29858000,  08/14/18,0,730979301
118056445,Unable to obtain - Suicide risk,UNABLETOOBTAINSUICIDERISK,Unable to obtain select on Adult Admission Assessment on Suicide risk,1,,,1,0,29858000,  08/14/18,0,730979301
18256672,QM - Beta-Blocker Contraindicated,QMBETABLOCKERCONTRAINDICATED,Patients who have a contraindication to Beta-Blockers,1,,,1,0,28127306,  05/12/16,0,969797469
18954404,QM - TOB Cessation Med Home,QMTOBCESSATIONMEDHOME,Patients who have a Cessation medication as a documented home med on this encounter.,1,,,1,0,23353630,  05/31/16,0,1005423182
19374321,NARCOTIC_ERX_ERROR,NARCOTICERXERROR,Patients who have a prescription for a controlled substance with an eRx Error.,1,,,1,0,749931,  06/10/16,0,1024912599
19498041,QM - SEP Severe Sepsis Alert Active,QMSEPSEVERESEPSISALERTACTIVE,Patients who have an active severe sepsis alert order that has not been addressed.,1,,,1,0,23353630,  06/13/16,0,1029483627
19498123,QM - SEP Simple Sepsis Alert Active,QMSEPSIMPLESEPSISALERTACTIVE,Patients who have an active sepsis alert order that has not been addressed.,1,,,1,0,23353630,  06/13/16,0,1029483627
21654390,Isolation Precautions - Droplet,ISOLATIONPRECAUTIONSDROPLET,Patient with isolation order with droplet precautions,2,"{ISOLATIONORDER}.COUNT>0 AND {ISOLATIONORDER}.VALUE=""*Droplet Precautions*""",,0,0,28536192,  07/21/16,0,1100709736
28467415,Glucose OrderGlucose Order,GLUCOSEORDERGLUCOSEORDER,Patient with an order for Glucose Level,1,,,1,0,26977162,  10/27/16,0,1295654379
28467438,HgbA1C Order,HGBA1CORDER,Patient with an order for HgbA1C,1,,,1,0,26977162,  10/27/16,0,1295654379
30735525,QM - CARDREHAB Consult Inpatient Cardiac Rehab,QMCARDREHABCONSULTINPATIENTCARDIACREHAB,Patients with an inpatient order for cardiac rehab consult,1,,,1,0,23353630,  12/01/16,0,1362667000
30735583,Angina Pectoris Dx,ANGINAPECTORISDX,Patients with active diagnosis codes for Angina pectoris including vasospastic forms,1,,,1,0,23353630,  12/01/16,0,1362667000
30735691,QM - CARDREHAB Discharge Contraindicated,QMCARDREHABDISCHARGECONTRAINDICATED,Patients who have a contraindication to outpatient cardiac rehabilitation referral at discharge.,1,,,1,0,23353630,  12/01/16,0,1362667000
30735741,QM - CARDREHAB Inpatient Contraindicated,QMCARDREHABINPATIENTCONTRAINDICATED,Patients who have a contraindication to setting up cardiac rehabilitation referral while inpatient.,1,,,1,0,23353630,  12/01/16,0,1362667000
30735807,QM - CARDREHAB Referred to Outpatient Cardiac Rehab,QMCARDREHABREFERREDTOOUTPATIENTCARDIACREHAB,Patients referred to outpatient cardiac rehab,1,,,1,0,23353630,  12/01/16,0,1362667000
30735849,QM - CARDREHAB Referral Required,QMCARDREHABREFERRALREQUIRED,Patients who qualify to be referred to early outpatient cardiac rehabilitation,2,{QMCVSURGERYPERFORMED}.count + {QMAMIQUALITYMEASURE}.count + {QMHFQUALITYMEASURE}.count + {ANGINAPECTORISDX}.count > 0,,0,0,23353630,  02/01/17,1,1487491074
33457083,Anticipated Discharge To,ANTICIPATEDDISCHARGETO,Patients with a documented anticipated discharge to location,1,,,1,0,27684549,  01/10/17,0,1440621355
33457108,Patient Preferred Pharmacy,PATIENTPREFERREDPHARMACY,Patient has a documented preferred pharmacy,1,,,1,0,27684549,  01/10/17,0,1440621355
35047800,QM - CARDREHAB Referral Required DC CVSURG,QMCARDREHABREFERRALREQUIREDDCCVSURG,Patients for whom Cardiac Rehab is required in the Discharge side and due to CV Surgery and PCI during this encounter.,2,{QMCARDREHABREFERRALREQUIRED} AND ({QMCVSURGERYPERFORMED}.count > 0),,0,0,23353630,  01/25/17,0,1472559221
35561653,Patient Discharge Follow Up,PATIENTDISCHARGEFOLLOWUP,Patients with a documented discharge follow up,1,,,1,0,28456740,  01/30/17,1,1482695584
41067020,Pain Value Last Charted,PAINVALUELASTCHARTED,Last charted value of pain score from either numeric or FACES,1,,,0,0,26858777,  03/21/17,0,1589774355
41067361,Pain Value Last Charted - High,PAINVALUELASTCHARTEDHIGH,Last charted FACES pain score greater than or equal to 5 or Numeric Scores greater than or equal to 5,2,"{PAINVALUELASTCHARTED}.count>0 and ({PAINVALUELASTCHARTED}.value=""5 = Moderate pain"" or {PAINVALUELASTCHARTED}.value=""6"" or {PAINVALUELASTCHARTED}.value=""7"" or {PAINVALUELASTCHARTED}.value=""8"" or {PAINVALUELASTCHARTED}.value=""9"" or {PAINVALUELASTCHARTED}.value= ""10 = Worst possible pain"" or {PAINVALUELASTCHARTED}.value=""10 = Hurts worst"" or {PAINVALUELASTCHARTED}.value=""8 = Hurts whole lot"" or {PAINVALUELASTCHARTED}.value=""6 = Hurts even more"")",,0,0,26858777,  03/21/17,0,1589774355
44477966,Safe Patient Handling Score,SAFEPATIENTHANDLINGSCORE,Patients with a documented safe patient handling score as welll as a reference to what the last documented score was,1,,,1,0,747930,  04/19/17,0,1651594128
44478147,Safe Patient Handling Score - High,SAFEPATIENTHANDLINGSCOREHIGH,Patients with a documented safe patient handling score of 60 or more,2,{SAFEPATIENTHANDLINGSCORE}. COUNT > 0 AND cnvtint({SAFEPATIENTHANDLINGSCORE}.VALUE) > 59,,0,0,747930,  04/19/17,0,1651594128
53102317,MEDICAREOBSPATIENTSWITHLOSGREATERTHAN2DAYS,MEDICAREOBSPATIENTSWITHLOSGREATERTHAN2DAYS,Medicare paitents with and encounter status of OBS and a LOS greater than 2 days that still have an AOT order in an OBS status,2,{MEDICAREPATIENTS}.count > 0 and {DEMOGRAPHICS}.HOSPITAL_DAY > 2 and {ADMISSIONORDEROBS},,0,0,26306531,  07/05/17,0,1807444897
57079056,IMM - Age Less Than Six Months,IMMAGELESSTHANSIXMONTHS,"Patients whose birthdate is less than six months from today.  The patient's birthdate is set as the anchor date for the concept which then expires 6,M after the birthdate.",1,,"6,M",0,0,23353630,  08/08/17,0,1881584890
58203859,Encounter Type,ENCOUNTERTYPE,The encounter type.  Value written to concept.,1,,,1,0,23353630,  08/17/17,0,1901672507
60333016,IMM - Vaccine Due,IMMVACCINEDUE,Patients with active vaccine orders due to administer within the current encounter.,1,,,1,0,23353630,  08/28/17,0,1924896055
62113170,Restraint Shift Documentation,RESTRAINTSHIFTDOCUMENTATION,Patients who have had an End Shift restraint assessment performed in the last 13 hours beginning with the restraint initiation date/time,1,,"13,H",0,0,747930,  09/06/17,0,1945010165
62113369,Documentation of Restraints and No Begin Shift Attestation,DOCUMENTATIONOFRESTRAINTSANDNOBEGINSHIFTATTESTATION,Patients with documentation of active non violent restraints and no Begin Shift Attestation within the last 13 hours,2,{DOCUMENTATIONOFRESTRAINTSNONVIOLENT}.COUNT > 0 AND {RESTRAINTSHIFTDOCUMENTATIONBEGINSHIFT}.COUNT = 0,,0,0,747930,  09/06/17,0,1945010165
69203459,EWS - MEWS Score,EWSMEWSSCORE,The current real time MEWS score for the encounter,1,,,1,0,23353630,  10/26/17,0,2057287707
69203868,EWS - MEWS Delivered High,EWSMEWSDELIVEREDHIGH,Patients from the atomic EWSMEWSLASTDELIVEREDALERTLEVEL who have a string value of High,2,{EWSMEWSLASTDELIVEREDALERTLEVEL}.VALUE = 'High',,0,0,29858000,  11/14/17,1,2100985677
91512149,QM - Antipsychotic Justification Combo Value,QMANTIPSYCHOTICJUSTIFICATIONCOMBOVALUE,Value of History of at least 3 failed multiple trials of monotherapy and Plan to taper to monotherapy or cross-taper ongoing at dc,2,"{QMHBIPSMULTIANTIPSYCHRXJUSTIFICATION}.VALUE= ""*History of at least 3 failed multiple trials of monotherapy and plan to taper to monotherapy*""",,0,0,26977162,  03/15/18,2,247971793
97919561,ACO Admission,ACOADMISSION,Admitted/ED patients who have a provider that participates in an ACO (Accountable Care Organization),1,,,0,0,4885934,  03/01/22,3,615661285
18260476,QM - HBIPS Multi Antipsych Rx Justification,QMHBIPSMULTIANTIPSYCHRXJUSTIFICATION,Patients with a documented justification for multiple antipsychotic prescriptions,1,,,1,0,28127306,  05/12/16,0,969797469
18954482,QM - TOB Cessation Rea NtGvn,QMTOBCESSATIONREANTGVN,Contraindication for Tobacco Cessation Medication.,1,,,1,0,23353630,  05/31/16,0,1005423182
19087621,QM - VTE Quality Measures,QMVTEQUALITYMEASURES,Patients who are eligible for VTE Quality Measures,1,,,1,0,23353630,  06/03/16,0,1012106922
19187266,QM - Statin Home Med,QMSTATINHOMEMED,Patients who have Statin as a home med on this encounter.,1,,,0,0,23353630,  06/06/16,0,1016050929
21653642,Admission Order,ADMISSIONORDER,Patients with an active AOT order and a reference to the encounter status,1,,,1,0,28536192,  07/21/16,0,1100709736
21653746,Admission Order - Obs,ADMISSIONORDEROBS,"Patients with an active admission order whose status is ""Place in Observation""",2,"{ADMISSIONORDER}.COUNT > 0 AND {ADMISSIONORDER}.VALUE = ""Place in Observation""",,0,0,28536192,  07/21/16,0,1100709736
21653784,Admission Order - Observation 16 - 20 hours,ADMISSIONORDEROBSERVATION1620HOURS,Patient with admission order with admission type of observation with an order between 16-20 hours of age,2,{ADMISSIONORDEROBS} AND {ADMISSIONORDER}.AGE >960 AND {ADMISSIONORDER}.AGE<1200,,0,0,28536192,  07/21/16,0,1100709736
21653968,Dialysis,DIALYSIS,"Patient with active order for hemodialysis, PD, CRRT, CVVH, Plasmapheresis",1,,,1,0,28536192,  07/21/16,0,1100709736
21654139,Discharge to Outside Facility,DISCHARGETOOUTSIDEFACILITY,Patient with an active order for discharge to an outside facility,2,"{DISCHARGEREQUESTORDER}.COUNT>0 AND ({DISCHARGEREQUESTORDER}.VALUE= ""Acute Care Facility"" OR {DISCHARGEREQUESTORDER}.VALUE = ""Long Term Acute Care Hospital"" OR {DISCHARGEREQUESTORDER}.VALUE = ""Rehabilitation Unit/Facility"" OR {DISCHARGEREQUESTORDER}.VALUE= ""Acute Care Facility Emergency Department"" OR {DISCHARGEREQUESTORDER}.VALUE= ""Law Enforcement Detention"" OR {DISCHARGEREQUESTORDER}.VALUE= ""Psychiatric Unit/Facility"" OR {DISCHARGEREQUESTORDER}.VALUE= ""Hospice Unit/Facility"" OR {DISCHARGEREQUESTORDER}.VALUE= ""Skilled Nursing Unit/Facility"" OR {DISCHARGEREQUESTORDER}.VALUE= ""Detox unit"" OR {DISCHARGEREQUESTORDER}.VALUE= ""Licensed Child Placement Agency/CPS"" OR {DISCHARGEREQUESTORDER}.VALUE= ""Other Non-acute Care Facility"" OR {DISCHARGEREQUESTORDER}.VALUE= ""Residential Facility/Group Home"" OR {DISCHARGEREQUESTORDER}.VALUE= ""Intermediate Care Facility"" OR {DISCHARGEREQUESTORDER}.VALUE= ""Shelter"")",,0,0,29950371,  08/13/20,5,1738564053
21654856,Sensory Deficit - Visual,SENSORYDEFICITVISUAL,Patient with documented visual deficit in Admission History or iView,2,"({LEFTEYESYMPTOMS}.COUNT > 0 AND ({LEFTEYESYMPTOMS}.VALUE=""* Loss of vision*"" OR {LEFTEYESYMPTOMS}.VALUE=""* Vision impairment*""))  OR  ({RIGHTEYESYMPTOMS}.COUNT > 0 AND ({RIGHTEYESYMPTOMS}.VALUE=""* Loss of vision*"" OR {RIGHTEYESYMPTOMS}.VALUE=""* Vision impairment*""))  OR  ({SENSORYDEFICIT}.COUNT > 0 AND ({SENSORYDEFICIT}.VALUE = ""*Blind, left eye*"" OR {SENSORYDEFICIT}.VALUE = ""*Blind, right eye*"" OR {SENSORYDEFICIT}.VALUE = ""*Uncorrected visual impairment*""))",,0,0,28536192,  07/21/16,0,1100709736
23743562,Isolation Precautions - Protective Environment,ISOLATIONPRECAUTIONSPROTECTIVEENVIRONMENT,Patient with isolation order for protective environment precautions,2,"{ISOLATIONORDER}. COUNT>0 AND {ISOLATIONORDER}.VALUE=""*Protective Environment Precautions*""",,0,0,28536192,  08/18/16,0,1155724802
33455384,Pending Provider Consults,PENDINGPROVIDERCONSULTS,Patients with a consult order in an ordered status,1,,,1,0,28456740,  01/10/17,0,1440595519
33455491,Anticipated Discharge Needs and DME,ANTICIPATEDDISCHARGENEEDSANDDME,Patient with any documentation from the DC Needs I Section (PFs; Discharge Planning asssessment and On-Going planning assessment),1,,,1,0,28456740,  01/10/17,0,1440595519
35045013,QM - CARDREHAB Referral Required IP HF,QMCARDREHABREFERRALREQUIREDIPHF,Patients for whom Cardiac Rehab is required in the Inpatient side and due to HF.,2,{QMCARDREHABREFERRALREQUIREDIP} AND ({QMHFQUALITYMEASURE}.count > 0),,0,0,23353630,  01/25/17,0,1472559221
46933142,QM - VTE Risk Level,QMVTERISKLEVEL,Patients with a documented VTE risk level.  Level is retained in the concept.,1,,,1,0,29638038,  05/11/17,0,1696412990
46933277,QM - VTE Mech Prophylaxis Ordered,QMVTEMECHPROPHYLAXISORDERED,Patients with Mechanical VTE prophylaxis ordered,1,,,1,0,29638038,  05/11/17,0,1696445521
46933674,Vent and No Weaning Readiness,VENTANDNOWEANINGREADINESS,Patients with an active vent order or documentation and  no documentation of a weaning readiness assessment performed in the last 24 hours,2,{VENTS} AND {VENTSPATIENTWEANINGREADINESS}.COUNT = 0,,0,0,29638038,  05/12/17,1,1699122528
46933754,Vent and No Spontaneous Breathing Trial,VENTANDNOSPONTANEOUSBREATHINGTRIAL,Patients with an active vent order or documentation and no documentation of a spontaneous breathing trial assessment performed in the last 24 hours,2,{VENTS} AND {VENTSPATIENTWEANINGREADINESS}.VALUE = '*SAT Screen Pass*'  AND ({VENTSPATIENTWEANINGREADINESS}.AGE < {VENTSBREATHINGTRIALRESULTS}.AGE OR {VENTSBREATHINGTRIALRESULTS}.COUNT = 0),,0,0,30365432,  02/11/20,2,976438262
47070994,Vent Initiate,VENTINITIATE,Patients with documentation of Vent Initiation,1,,,1,0,29638038,  05/12/17,0,1699009113
47467288,Vent Documentation,VENTDOCUMENTATION,Patients with a ventilator start time more recent than a ventilator stop time,1,,,1,0,29638038,  05/16/17,0,1706193465
47467331,Vent Reintubation,VENTREINTUBATION,Patients with documentation of a ventilator start time within 24 hours of a ventilator stop time,1,,,1,0,29638038,  05/16/17,0,1706193465
91511258,QM - Antipsychotic Justification Plan to Taper,QMANTIPSYCHOTICJUSTIFICATIONPLANTOTAPER,Documentation of a recommended plan to taper to monotherapy,1,,,1,0,26977162,  03/13/18,0,241364621
91512075,QM - Antipsychotic Justification Clozapine Value,QMANTIPSYCHOTICJUSTIFICATIONCLOZAPINEVALUE,Value of Documented augmentation of Clozapine,2,"{QMHBIPSMULTIANTIPSYCHRXJUSTIFICATION}.VALUE= ""*Documented augmentation of Clozapine*""",,0,0,26977162,  03/15/18,1,247971793
91512223,QM - Antipsychotic Justification Failed Monotherapy Value,QMANTIPSYCHOTICJUSTIFICATIONFAILEDMONOTHERAPYVALUE,Value of History of at least 3 failed multiple trials of monotherapy in Antipsychotic Justificaiton,2,"{QMHBIPSMULTIANTIPSYCHRXJUSTIFICATION}.VALUE = ""History of at least 3 failed multiple trials of monotherapy""",,0,0,26977162,  03/15/18,1,247971793
91512270,QM - Antipsychotic Justification Plan to Taper Value,QMANTIPSYCHOTICJUSTIFICATIONPLANTOTAPERVALUE,Value of Plan to taper to monotherapy or cross-taper ongoing at dc,2,"{QMHBIPSMULTIANTIPSYCHRXJUSTIFICATION}.VALUE= ""*Plan to taper to monotherapy or cross-taper ongoing at dc*""",,0,0,26977162,  03/15/18,1,247971793
93929725,QM - STK Ischemic,QMSTKISCHEMIC,Patients with diagnosed Ischemic Stroke,1,,,1,0,29858000,  03/27/18,0,276708850
97447646,Patient Location - MMH,PATIENTLOCATIONMMH,Patient is located at MMH facility.,1,,,1,0,28997562,  04/16/18,0,334309545
108203384,No Discharge Request Order,NODISCHARGEREQUESTORDER,Patients without an active discharge request order,2,{DISCHARGEREQUESTORDER}.COUNT = 0,,0,0,27684549,  06/18/18,0,525889096
108203556,Home Oxygen Rx Order,HOMEOXYGENRXORDER,Patients with a Home Oxygen prescription order,1,,,1,0,27684549,  06/18/18,0,525889096
108205143,Clinical Summary Complete,CLINICALSUMMARYCOMPLETE,Patients that have a completed Clinical Summary document,1,,,1,0,27684549,  06/18/18,0,525889096
108205167,Nursing Discharge Summary Complete,NURSINGDISCHARGESUMMARYCOMPLETE,Patients that have a completed Discharge Summary powerform,1,,,1,0,27684549,  06/18/18,0,525889096
108205401,Clinical Summary Not Complete,CLINICALSUMMARYNOTCOMPLETE,Patients that do NOT have a completed Clinical Summary document,2,{CLINICALSUMMARYCOMPLETE}.COUNT = 0,,0,0,27684549,  06/18/18,0,525889096
19486248,QM - Left Ventricular Systolic Dysfunction,QMLEFTVENTRICULARSYSTOLICDYSFUNCTION,Patients with LVSD as defined as less than 40%,2,cnvtint({QMLEFTVENTRICULAREJECTIONFRACTION}.VALUE) < 40 AND {QMLEFTVENTRICULAREJECTIONFRACTION}.COUNT > 0,,0,0,28127306,  06/13/16,0,1029044869
19497976,QM - SEP Clinical Sepsis Alert Triggered,QMSEPCLINICALSEPSISALERTTRIGGERED,Patients who had a manual clinically indicated sepsis alert triggered at any time in their encounter.,1,,,1,0,23353630,  06/13/16,0,1029483627
21653680,Admission Order - IP,ADMISSIONORDERIP,"Patients with an active admission order whose status is ""Admit to Inpatient""",2,"{ADMISSIONORDER}.COUNT > 0 AND {ADMISSIONORDER}.VALUE = ""Admit as Inpatient""",,0,0,28536192,  07/21/16,0,1100709736
21653881,Bedside Blood Glucose Monitoring,BEDSIDEBLOODGLUCOSEMONITORING,Patient with active order for bedside blood glucose monitoring,1,,,1,0,28536192,  07/21/16,0,1100709736
21654183,EB - Blood Specimen Nurse Collection,EBBLOODSPECIMENNURSECOLLECTION,"Contains all patients who are Nurse Collect ‘Yes’ with specimen type Blood, Serum or Plasma",1,,,1,0,28536192,  07/21/16,0,1100709736
21654276,Isolation Order - Contact,ISOLATIONORDERCONTACT,Patient with isolation order with contact precautions,2,"{ISOLATIONORDER}.COUNT>0 AND {ISOLATIONORDER}.VALUE=""Contact Precautions""",,0,0,29585260,  04/23/24,1,1415588949
33455315,Discharge Med Rec Greater Than 24 Hr,DISCHARGEMEDRECGREATERTHAN24HR,Patient has a discharge med rec that was completed more than 24 hours ago,2,{DISCHARGEMEDICATIONRECONCILIATION}.AGE > 1440,,0,0,28456740,  01/10/17,1,1440700799
33455613,Pending Support Services,PENDINGSUPPORTSERVICES,Patients with outstanding tasks from support service orders,1,,,1,0,28456740,  01/10/17,0,1440595519
34566712,QM - CARDREHAB Referral Required IP,QMCARDREHABREFERRALREQUIREDIP,"Patients for whom CARDREHAB is both required, and the patient is in a facility where the inpatient measureset should be active",2,"({QMCARDREHABREFERRALREQUIRED} AND ({QMCARDREHABFACILITYFLEXING}.value = ""BOTH""))",,0,0,23353630,  01/26/17,1,1474490054
41066914,Pain Level Not Acceptable to Patient,PAINLEVELNOTACCEPTABLETOPATIENT,Patients with NO documented for pain level accepatable,1,,,0,0,26858777,  03/21/17,0,1589774355
41067472,Provider Notified for Pain Management,PROVIDERNOTIFIEDFORPAINMANAGEMENT,Patients who had a provider notified for their pain management as well as a reference to which provider was notified,1,,,0,0,26858777,  03/21/17,0,1589774355
41764758,No Responsible Provider,NORESPONSIBLEPROVIDER,Patients with no responsible provider documented,2,{RESPONSIBLEPROVIDER}.COUNT = 0,,0,0,747930,  03/27/17,0,1602371705
46931955,Active TPN Order,ACTIVETPNORDER,Patients with an active TPN order,1,,,1,0,29638038,  05/11/17,0,1696412990
46932014,Active Enteral Tube Feed Order,ACTIVEENTERALTUBEFEEDORDER,Patients with an active enteral tube feed order,1,,,1,0,29638038,  05/11/17,0,1696412990
46933218,QM - VTE Pharm Prophylaxis Ordered,QMVTEPHARMPROPHYLAXISORDERED,Patients with pharmacologic VTE Prophylaxis ordered,1,,,1,0,29638038,  05/11/17,0,1696445521
