CUST_CONCEPT_ID,CONCEPT_NAME,CONCEPT_NAME_KEY,CONCEPT_DESC,CONCEPT_TYPE_FLAG,CONCEPT_RELTN,EXPIRE_LOOKAHEAD,EXPIRE_ON_DISCHARGE,MULTIPLE_ENTRY_IND,UPDT_ID,UPDT_DT_TM,UPDT_CNT,UPDT_APPLCTX
165420363,QM - CSTK4 - Facilities,QMCSTK4FACILITIES,Patients at facilities who qualify for Comprehensive Stroke 4,2,"{FACILITY}.VALUE in (""GW Hospital"")",,0,0,29858000,  02/12/19,0,1422605211
169568329,Concierge Pharmacy Program,CONCIERGEPHARMACYPROGRAM,Patients that have opted into concierge pharmacy program,1,,,1,0,26807360,  02/25/19,0,1474900663
181129602,Medical Service,MEDICALSERVICE,Encounter's recorded Medical Service,1,,,1,0,28997562,  04/01/19,0,1624733277
222861852,PATCH - Clonidine,PATCHCLONIDINE,Encounters where there is at least one active order for 'Clonidine Patch Removal'  This indicates a clonidine patch has been documented on the patient.,1,,,1,0,26807360,  06/24/19,0,2003988463
222862322,PATCH - Estradiol,PATCHESTRADIOL,Encounters where there is at least one active order for Estradiol Patch Removal  This indicates a Estradiol patch has been documented on the patient.,1,,,1,0,26807360,  06/24/19,0,2003988463
222862701,PATCH - Estradiol-Levonorgestrel,PATCHESTRADIOLLEVONORGESTREL,Encounters where there is at least one active order for Estradiol-Levonorgestrel Patch Removal  This indicates a Estradiol-Levonorgestrel patch has been documented on the patient.,1,,,1,0,26807360,  06/24/19,0,2003988463
222863037,PATCH - Fentanyl,PATCHFENTANYL,Encounters where there is at least one active order for Fentanyl Patch Removal'  This indicates a Fentanyl patch has been documented on the patient.,1,,,1,0,26807360,  06/24/19,0,2003988463
222863273,PATCH - Granisetron,PATCHGRANISETRON,Encounters where there is at least one active order for Granisetron Patch Removal  This indicates a Granisetron patch has been documented on the patient.,1,,,1,0,26807360,  06/24/19,0,2003988463
222863514,PATCH - Methylphenidate,PATCHMETHYLPHENIDATE,Encounters where there is at least one active order for Methylphenidate Patch Removal  This indicates a Methylphenidate patch has been documented on the patient.,1,,,1,0,26807360,  06/24/19,0,2003988463
222869171,PATCH - Selegiline Assessed,PATCHSELEGILINEASSESSED,Encounters where PATCH - Selegiline Assessed clinical event has been documented in the past 1 hour,1,,"1,H",1,0,26807360,  09/03/19,1,198674711
222870500,PATCH - Estradiol Exists NOT Assessed,PATCHESTRADIOLEXISTSNOTASSESSED,Encounters where there is at least one active order for Estradiol Patch Removal  and  where PATCH - Estradiol Assessed clinical event has NOT been documented in the past 10 hours.,2,{PATCHESTRADIOL}.COUNT > 0 AND {PATCHESTRADIOLASSESSED}.COUNT = 0,,0,0,26807360,  06/24/19,0,2003988463
222870912,PATCH - Estradiol-Levonorgestrel Exists NOT Assessed,PATCHESTRADIOLLEVONORGESTRELEXISTSNOTASSESSED,Encounters where there is at least one active order for Estradiol-Levonorgestrel Patch Removal  and  where PATCH - Estradiol-Levonorgestrel Assessed clinical event has NOT been documented in the past 10 hours.,2,{PATCHESTRADIOLLEVONORGESTREL}.COUNT > 0 AND {PATCHESTRADIOLLEVONORGESTRELASSESSED}.COUNT = 0,,0,0,26807360,  06/24/19,0,2003988463
222872310,PATCH - Methylphenidate Exists NOT Assessed,PATCHMETHYLPHENIDATEEXISTSNOTASSESSED,Encounters where there is at least one active order for Methylphenidate Patch Removal  and  where PATCH - Methylphenidate Assessed clinical event has NOT been documented in the past 10 hours.,2,{PATCHMETHYLPHENIDATE}.COUNT > 0 AND {PATCHMETHYLPHENIDATEASSESSED}.COUNT = 0,,0,0,26807360,  06/24/19,0,2003988463
222872645,PATCH - Nicotine Exists NOT Assessed,PATCHNICOTINEEXISTSNOTASSESSED,Encounters where there is at least one active order for Nicotine Patch Removal  and  where PATCH - Nicotine Assessed clinical event has NOT been documented in the past 10 hours.,2,{PATCHNICOTINE}.COUNT > 0 AND {PATCHNICOTINEASSESSED}.COUNT = 0,,0,0,26807360,  06/24/19,0,2003988463
222874166,PATCH - Rotigotine Exists NOT Assessed,PATCHROTIGOTINEEXISTSNOTASSESSED,Encounters where there is at least one active order for Rotigotine Patch Removal  and  where PATCH - Rotigotine Assessed clinical event has NOT been documented in the past 10 hours.,2,{PATCHROTIGOTINE}.COUNT > 0 AND {PATCHROTIGOTINEASSESSED}.COUNT = 0,,0,0,26807360,  06/24/19,0,2003988463
222874899,PATCH - Selegiline Exists NOT Assessed,PATCHSELEGILINEEXISTSNOTASSESSED,Encounters where there is at least one active order for Selegiline Patch Removal  and  where PATCH - Selegiline Assessed clinical event has NOT been documented in the past 10 hours.,2,{PATCHSELEGILINE}.COUNT > 0 AND {PATCHSELEGILINEASSESSED}.COUNT = 0,,0,0,26807360,  06/24/19,0,2003988463
222876594,Handoff Report Checklist Completed,HANDOFFREPORTCHECKLISTCOMPLETED,Encounters for which 'Handoff Report Checklist' documentation has been completed,1,,"10,H",1,0,38949313,  02/20/24,2,1201513539
222877044,Handoff Report Interpreter Completed,HANDOFFREPORTINTERPRETERCOMPLETED,Encounters for which 'Handoff Report Interpreter' documentation has been completed in past one hour,1,,"1,H",1,0,26807360,  06/24/19,0,2003988463
222877362,Handoff Report Receiving Sign-off Completed,HANDOFFREPORTRECEIVINGSIGNOFFCOMPLETED,Encounters for which 'Handoff Report Receiving Sign-off' documentation has been completed since the last documentation of Nurse Receiving Hanoff Report,1,,,1,0,26807360,  06/24/19,0,2003988463
222878188,Handoff Report Restraint End Shift Documentation Complete,HANDOFFREPORTRESTRAINTENDSHIFTDOCUMENTATIONCOMPLETE,Patients who have had an End Shift restraint assessment performed in past one hour,2,{RESTRAINTSHIFTDOCUMENTATION}.COUNT > 0 AND {RESTRAINTSHIFTDOCUMENTATION}.AGE < 60,,0,0,26807360,  06/24/19,0,2003988463
243998664,Handoff Report Offgoing Complete and Handoff Report Receiving Sign-off Not Complete,HANDOFFREPORTOFFGOINGCOMPLETEANDHANDOFFREPORTRECEIVINGSIGNOFFNOTCOMPLETE,Handoff Report Offgoing Complete as indicated by the completion of Handoff Report Checklist AND Handoff Report Receiving Sign-off Not Complete,2,{HANDOFFREPORTCHECKLISTCOMPLETED}.COUNT>0 AND {HANDOFFREPORTRECEIVINGSIGNOFFNOTCOMPLETE},,0,0,26807360,  07/25/19,0,3402469
276225230,Care Tool Nursing Triggered,CARETOOLNURSINGTRIGGERED,Status of Care Tool Nursing order = Ordered or Complete,2,({CARETOOLNURSING}.count + {CARETOOLNURSINGCOMPLETE}.count) > 0,,0,0,28304281,  09/10/19,0,233116390
276265029,QM - STK Rehab Contraindicated,QMSTKREHABCONTRAINDICATED,Encounter with a contraindication to stroke rehab evaluation,1,,,1,0,31551005,  09/10/19,0,233422990
163350682,123666984,12366698400,Patient with a documented problem or diagnosis of Difficult airway,1,,,0,0,4885934,  02/06/19,0,1396161203
164866213,QM - STK HEMORRHAGIC NOT AMB,QMSTKHEMORRHAGICNOTAMB,Patients with hemorrhagic stroke Encounter Type not Ambulatory in GW,2,{ENCOUNTERTYPENOTAMBULATORY} and {QMCSTK4FACILITIES} AND {QMSTKHEMORRHAGIC}.count > 0,,0,0,29858000,  02/12/19,1,1422605211
165221831,Urinary Catheter - Secured,URINARYCATHETERSECURED,Patients with documentation of secured device,1,,"12,H",1,0,26977162,  02/12/19,0,1420212949
165223835,CHG Bath,CHGBATH,Patients with documentation that CHG Bath has been performed,1,,"24,H",1,0,26977162,  02/12/19,0,1420212949
165224378,CHG Bath Not Daily,CHGBATHNOTDAILY,Patients that have not had a daily CHG Bath,2,{CHGBATH}.COUNT = 0,,0,0,26977162,  02/12/19,0,1420212949
165288399,Central Line - Femoralt,CENTRALLINEFEMORALT,ERROR,1,,,1,0,26977162,  02/12/19,1,1420973774
165288648,Central Line - Femoral Line Greater Than 24 Hrs,CENTRALLINEFEMORALLINEGREATERTHAN24HRS,Patients with documentation femoral line after 24 hours,2,{CENTRALLINEFEMORAL}.AGE > 1440,,0,0,26977162,  02/12/19,0,1420973774
181130868,Communication Barriers,COMMUNICATIONBARRIERS,"Documentation of any of the following on the patient: required language interpreter for the patient or the patient's guardian, a sensory deficit or language interpreter from the Admission history",2,{PREFERREDLANGUAGEINTERPRETERREQUIRED} OR {LANGUAGEINTERPRETERREQUIRED} OR {DOCUMENTEDSENSORYDEFICIT},,0,0,31904138,  02/24/20,3,1040577591
181434609,Positive HCG Test,POSITIVEHCGTEST,Patient has a positive HCG lab result,1,,,1,0,28997562,  04/02/19,0,1628694414
222867403,PATCH - Fentanyl Assessed,PATCHFENTANYLASSESSED,Encounters where PATCH - Fentanyl Assessed clinical event has been documented in the past 1 hour,1,,"1,H",1,0,26807360,  09/03/19,1,198674711
222868604,PATCH - Rivastigmine Assessed,PATCHRIVASTIGMINEASSESSED,Encounters where PATCH - Rivastigmine Assessed clinical event has been documented in the past 1 hour,1,,"1,H",1,0,26807360,  09/03/19,1,198674711
222868822,PATCH - Rotigotine Assessed,PATCHROTIGOTINEASSESSED,Encounters where PATCH - Rotigotine Assessed clinical event has been documented in the past 1 hour,1,,"1,H",1,0,26807360,  09/03/19,1,198674711
222869007,PATCH - Scopolamine Assessed,PATCHSCOPOLAMINEASSESSED,Encounters where PATCH - Scopolamine Assessed clinical event has been documented in the past 1 hour,1,,"1,H",1,0,26807360,  09/03/19,1,198674711
222870124,PATCH - Diclofenac Exists NOT Assessed,PATCHDICLOFENACEXISTSNOTASSESSED,Encounters where there is at least one active order for Diclofenac Patch Removal  and  where PATCH - Diclofenac Assessed clinical event has NOT been documented in the past 10 hours.,2,{PATCHDICLOFENAC}.COUNT > 0 AND {PATCHDICLOFENACASSESSED}.COUNT = 0,,0,0,26807360,  06/24/19,0,2003988463
222873797,PATCH - Rivastigmine Exists NOT Assessed,PATCHRIVASTIGMINEEXISTSNOTASSESSED,Encounters where there is at least one active order for Rivastigmine Patch Removal  and  where PATCH - Rivastigmine Assessed clinical event has NOT been documented in the past 10 hours.,2,{PATCHRIVASTIGMINE}.COUNT > 0 AND {PATCHRIVASTIGMINEASSESSED}.COUNT = 0,,0,0,26807360,  06/24/19,0,2003988463
222875253,PATCH - Testosterone Exists NOT Assessed,PATCHTESTOSTERONEEXISTSNOTASSESSED,Encounters where there is at least one active order for Testosterone Patch Removal  and  where PATCH - Testosterone Assessed clinical event has NOT been documented in the past 10 hours.,2,{PATCHTESTOSTERONE}.COUNT > 0 AND {PATCHTESTOSTERONEASSESSED}.COUNT = 0,,0,0,26807360,  06/24/19,0,2003988463
251288266,BP Type Central Venous Catheter Insertion,BPTYPECENTRALVENOUSCATHETERINSERTION,Pre-verification Procedure Type = Central Venous Catheter insertion,1,,"1,H",1,0,26807360,  08/11/20,1,1726517133
251290266,BP Type Central Venous Catheter Insertion and has Order,BPTYPECENTRALVENOUSCATHETERINSERTIONANDHASORDER,Pre-verification Procedure Type = Central Venous Catheter insertion AND active order for CVC Insertion,2,{BPTYPECENTRALVENOUSCATHETERINSERTION}.COUNT > 0 AND {CVCINSERTIONORDER}.COUNT > 0,,0,0,26807360,  08/11/20,1,1726517133
251983957,Hypoglycemia Protocol Advisor,HYPOGLYCEMIAPROTOCOLADVISOR,Patient is on the Hypoglycemia Protocol Advisor,1,,,1,0,29478950,  08/06/19,0,63256429
266469626,Patient Age Less Than 75,PATIENTAGELESSTHAN75,Patients Age Less than 75 years.,2,{PATIENTAGE}.AGE<39446190,,0,0,29242259,  08/27/19,0,165850208
268914737,BP Type Central Venous Catheter Insertion and has NO Order,BPTYPECENTRALVENOUSCATHETERINSERTIONANDHASNOORDER,Pre-verification Procedure Type = Central Venous Catheter insertion AND no active or complete order for CVC Insertion,2,{BPTYPECENTRALVENOUSCATHETERINSERTION}.COUNT > 0 AND ({CVCINSERTIONORDER}.COUNT + {BPDOCUMENTEDCENTRALVENOUSCATHETERINSERTION}.COUNT = 0),,0,0,26807360,  08/11/20,2,1726517133
268915276,BP Type PICC Line Insertion and has NO Order,BPTYPEPICCLINEINSERTIONANDHASNOORDER,Pre-verification Procedure Type = PICC line insertion AND no active order for PICC Insertion,2,{BPTYPEPICCLINEINSERTION}.COUNT > 0 AND {PICCINSERTIONORDER}.COUNT = 0,,0,0,26807360,  08/11/20,1,1726517133
290900973,Facility - APA,FACILITYAPA,Patients whose current facility begins with APA,2,"{FACILITY}.VALUE IN (""APA*"",""AIKN- Neuro"", ""AIKP- Pal Peds"",""AIKN Neuro"" )",,0,0,4885934,  03/02/20,3,1074861384
295259238,BP Type Arterial Line Insertion and has Order,BPTYPEARTERIALLINEINSERTIONANDHASORDER,Pre-verification Procedure Type = Arterial line insertion AND has an active order for Arterial line insertion,2,{BPTYPEARTERIALLINEINSERTION}.COUNT > 0 AND {ARTERIALLINEINSERTIONORDER}.COUNT > 0,,0,0,26807360,  08/11/20,2,1726517133
300228717,Pending Nutrition Consult,PENDINGNUTRITIONCONSULT,Patients with outstanding tasks from Nutrition consult orders.,1,,,1,0,27710283,  10/14/19,0,403880008
300233358,Pending Case Management Consult,PENDINGCASEMANAGEMENTCONSULT,Patients with outstanding tasks from Case Management consult orders,1,,,1,0,27710283,  10/14/19,0,403880008
301663531,HEPARINLABVALUE,HEPARINLABVALUE,Patient has a heparin advisor lab value result,1,,,1,0,29478950,  10/16/19,0,413787851
301663761,Heparin Protocol Advisor,HEPARINPROTOCOLADVISOR,Patient is on a Heparin Protocol Advisor,1,,,1,0,29478950,  10/16/19,0,413787851
301664484,Heparin Protocol and Lab Value,HEPARINPROTOCOLANDLABVALUE,Patient is on a Heparin Protocol Advisor and has a new lab value,2,{HEPARINPROTOCOLADVISOR}.COUNT > 0 AND {HEPARINLABVALUE}.COUNT > 0,,0,0,29478950,  10/16/19,0,413787851
302251574,Hepatitis B Vaccine,HEPATITISBVACCINE,Patient's that have a Hepatitis B pediatric vaccine order that is active or completed.,1,,"6,M",1,0,29242259,  12/18/19,1,715593787
302253688,Documented Date Time of Birth,DOCUMENTEDDATETIMEOFBIRTH,"Patient's with a documented Date, Time of Birth clinical event on the current encounter (this is the ""baby"" version of the clinical event)",1,,,1,0,29244900,  07/22/20,1,1645587771
159563250,Documentation of Hypernatremia without Dx,DOCUMENTATIONOFHYPERNATREMIAWITHOUTDX,Documentation of Hypernatremia and no documentation of rejection.,2,{HYPERNATREMIA}.count>0 AND {HYPERNATREMIADXREJECTED}.count =0 AND {HYPERNATREMIADIAGNOSIS}.count = 0,,0,0,26306531,  01/25/19,0,1346891222
159563293,Documentation of Hyponatremia without Dx,DOCUMENTATIONOFHYPONATREMIAWITHOUTDX,Documentation of Hyponatremia and no documentation of rejection.,2,{HYPONATREMIA}.count>0 AND {HYPONATREMIADXREJECTED}.count =0 AND {HYPONATREMIADIAGNOSIS}.count = 0,,0,0,26306531,  01/25/19,0,1346891222
159563442,HYPONATREMIA Diagnosis,HYPONATREMIADIAGNOSIS,Patients with abnormally low serum sodium level diagnosis,1,,,1,0,26306531,  01/25/19,0,1346891222
164863211,QM - Comfort Measures,QMCOMFORTMEASURES,Patient encounters where an order for Comfort Measures Only exists,1,,,1,0,29858000,  02/11/19,0,1415530187
164865059,QM - No INR,QMNOINR,Patient with resulted INRs or no active INR orders,2,({QMSTKINRGREATERTHAN14}.COUNT + {QMSTKINRLESSTHAN15}.COUNT + {QMINRACTIVEORDER}.COUNT) = 0,,0,0,29858000,  02/11/19,0,1415530187
164928313,Facility AIK Psych,FACILITYAIKPSYCH,Patients that are located at AIK Psych,2,"{FACILITY}.VALUE = ""AIKB Psych""",,0,0,26807360,  02/11/19,0,1416430813
164928908,Facility LWR,FACILITYLWR,Patients that are located at LWR,2,"{FACILITY}.VALUE = ""LWR Main""",,0,0,26807360,  02/11/19,0,1416430813
165221363,Urinary Catheter - Bag Location,URINARYCATHETERBAGLOCATION,Patients with documentation that foley bag is below the level of the bladder,1,,"12,H",1,0,26977162,  02/12/19,0,1420212949
165221736,Urinary Catheter - Closed System,URINARYCATHETERCLOSEDSYSTEM,Patients with documentation that the closed system has been maintained,1,,"12,H",1,0,26977162,  02/12/19,0,1420212949
181434777,Open Preg or Positive Hcg,OPENPREGORPOSITIVEHCG,Patient has an opened/confirmed pregnancy or a positive HCG Qual Test,2,{OPENPREGNANCY}.COUNT = 1 OR {POSITIVEHCGTEST}.COUNT > 0,,0,0,28997562,  04/02/19,0,1628694414
183543060,Encounter Type - Acute Non-ED,ENCOUNTERTYPEACUTENONED,"Patients whose current encounter type is indicative of a non-ed, acute visit.",2,"{ENCOUNTERTYPE}.COUNT > 0 AND {ENCOUNTERTYPE}.VALUE in ('Inpatient', 'Observation', 'Outpatient in a Bed', 'Day Surgery', 'Preadmit IP')",,0,0,28997562,  04/08/19,0,1655366760
222864288,PATCH - Rivastigmine,PATCHRIVASTIGMINE,Encounters where there is at least one active order for Rivastigmine Patch Removal  This indicates a Rivastigmine patch has been documented on the patient.,1,,,1,0,26807360,  06/24/19,0,2003988463
222864697,PATCH - Rotigotine,PATCHROTIGOTINE,Encounters where there is at least one active order for Rotigotine Patch Removal  This indicates a Rotigotine patch has been documented on the patient.,1,,,1,0,26807360,  06/24/19,0,2003988463
222864989,PATCH - Scopolamine,PATCHSCOPOLAMINE,Encounters where there is at least one active order for Scopolamine Patch Removal  This indicates a Scopolamine patch has been documented on the patient.,1,,,1,0,26807360,  06/24/19,0,2003988463
222865162,PATCH - Selegiline,PATCHSELEGILINE,Encounters where there is at least one active order for Selegiline Patch Removal  This indicates a Selegiline patch has been documented on the patient.,1,,,1,0,26807360,  06/24/19,0,2003988463
222865489,PATCH - Testosterone,PATCHTESTOSTERONE,Encounters where there is at least one active order for Testosterone Patch Removal  This indicates a Testosterone patch has been documented on the patient.,1,,,1,0,26807360,  06/24/19,0,2003988463
222867041,PATCH - Estradiol Assessed,PATCHESTRADIOLASSESSED,Encounters where PATCH - Estradiol Assessed clinical event has been documented in the past 1 hour,1,,"1,H",1,0,26807360,  09/03/19,1,198674711
222873151,PATCH - Oxybutinin Exists NOT Assessed,PATCHOXYBUTININEXISTSNOTASSESSED,Encounters where there is at least one active order for Oxybutinin Patch Removal  and  where PATCH - Oxybutinin Assessed clinical event has NOT been documented in the past 10 hours.,2,{PATCHOXYBUTININ}.COUNT > 0 AND {PATCHOXYBUTININASSESSED}.COUNT = 0,,0,0,26807360,  06/24/19,0,2003988463
222877609,Handoff Report Receiving Sign-off Not Complete,HANDOFFREPORTRECEIVINGSIGNOFFNOTCOMPLETE,Encounters for which 'Handoff Report Receiving Sign-off' documentation has NOT been completed since the last documentation of Nurse Receiving Hanoff Report,2,{HANDOFFREPORTRECEIVINGSIGNOFFCOMPLETED}.COUNT = 0,,0,0,26807360,  06/24/19,0,2003988463
223636189,EWS - MEOWS Score,EWSMEOWSSCORE,The current MEOWS score for the encounter,1,,,1,0,23353630,  06/25/19,0,2009746020
223642747,EWS - MEOWS Delivered Low,EWSMEOWSDELIVEREDLOW,Patients from the atomic EWSMEOWSLASTDELIVEREDALERTLEVEL who have a string value of Low,2,{EWSMEOWSLASTDELIVEREDALERTLEVEL}.VALUE = 'Low',,0,0,23353630,  06/25/19,0,2009746020
249814866,BP Pre Verification Complete,BPPREVERIFICATIONCOMPLETE,"BP Pre Verification documentation complete as indicated by documentation of required elements: Bedside Procedure Pre-verification RN, Bedside Procedure Type, Bedside Procedure Pre-verification Patient, Bedside Procedure Pre-verification Provider",1,,"1,H",1,0,28456740,  08/02/19,0,47763808
251290620,BP Type PICC Line Insertion and has Order,BPTYPEPICCLINEINSERTIONANDHASORDER,Pre-verification Procedure Type = PICC line insertion AND has an active order for PICC Insertion,2,{BPTYPEPICCLINEINSERTION}.COUNT > 0 AND {PICCINSERTIONORDER}.COUNT > 0,,0,0,26807360,  08/11/20,1,1726517133
251291098,BP Type Midline Insertion and has Order,BPTYPEMIDLINEINSERTIONANDHASORDER,Pre-verification Procedure Type = Midline insertion AND has an active order for Midline Insertion,2,{BPTYPEMIDLINEINSERTION}.COUNT > 0 AND {MIDLINEINSERTIONORDER}.COUNT > 0,,0,0,26807360,  08/11/20,1,1726517133
251983373,Glucose Less Than 70,GLUCOSELESSTHAN70,Patient has glucose result that is less that 70,1,,,1,0,29478950,  08/06/19,0,63256429
252028776,TTM Nurse Protocol Order,TTMNURSEPROTOCOLORDER,Patients with active Targeted Temperature Management Nursing Protocol order,1,,,1,0,26807360,  08/06/19,0,63536487
268909939,Hypoglycemia and Glu Less Than 70,HYPOGLYCEMIAANDGLULESSTHAN70,Patient is on the Hypoglycemia Advisor and has a Glucose Result Less Than 70,2,{HYPOGLYCEMIAPROTOCOLADVISOR}.COUNT > 0 AND {GLUCOSELESSTHAN70}.COUNT > 0,,0,0,29478950,  08/30/19,1,183440447
276224013,Care Tool Nursing,CARETOOLNURSING,Status of Care Tool Nursing order = Ordered,1,,,1,0,28304281,  09/10/19,0,233116390
295257138,Arterial Line Order,ARTERIALLINEORDER,Patients with an active order for an Arterial Line,1,,,1,0,26807360,  10/07/19,0,369357974
295275430,Arterial Line Insertion Order,ARTERIALLINEINSERTIONORDER,Patients that have an active order for Arterial Line Insertion,1,,,1,0,26807360,  10/07/19,0,369357974
300236217,Dialysis - Hemo or PD,DIALYSISHEMOORPD,Patient with active order for hemodialysis or PD,1,,,1,0,27710283,  10/14/19,0,403880008
301664005,Heparin Protocol Advisor ACS,HEPARINPROTOCOLADVISORACS,Patient is on the Heparin Protocol Advisor ACS,2,"{HEPARINPROTOCOLADVISOR}.VALUE=""Heparin Protocol - ACS""",,0,0,29478950,  10/16/19,0,413787851
140318248,Hypokalemia DX Rejected,HYPOKALEMIADXREJECTED,Rejected Hypokalemia Diagnoses,1,,,1,0,30025061,  11/20/18,0,1085688494
140318415,Documentation of Hyperkalemia without Dx,DOCUMENTATIONOFHYPERKALEMIAWITHOUTDX,Documentation of Hyperkalemia and no documentation of rejection.,2,{HYPERKALEMIA}.count>0 AND {HYPERKALEMIADXREJECTED}.count =0 AND {HYPERKALEMIADIAGNOSIS}.count =0,,0,0,27710283,  02/16/23,2,276322128
159563413,HYPERNATREMIA Diagnosis,HYPERNATREMIADIAGNOSIS,Patients with an elevated serum sodium level diagnosis,1,,,1,0,26306531,  01/25/19,0,1346891222
164861318,QM - STK Procoagulant Order,QMSTKPROCOAGULANTORDER,Patient encounters where a procoagulant product was ordered.,1,,,1,0,29858000,  02/11/19,0,1415530187
164861546,QM - STK Procoagulant Contra,QMSTKPROCOAGULANTCONTRA,Patients with a contraindication to procoagulant use.,1,,,1,0,29858000,  02/11/19,0,1415530187
165221569,Urinary Catheter - Care,URINARYCATHETERCARE,Patients with documentation that Urinary Cath Care has been performed,1,,"12,H",1,0,26977162,  02/12/19,0,1420212949
165279581,Central Line - Alcohol Caps,CENTRALLINEALCOHOLCAPS,Patients with alcohol caps on injection ports,1,,"12,H",1,0,26977162,  02/12/19,0,1420973774
165280113,Central Line - Dressing Change,CENTRALLINEDRESSINGCHANGE,Patients with a Central Line dressing change,1,,"7,D",1,0,26977162,  02/12/19,0,1420973774
165280447,Central Line - No Alcohol Caps,CENTRALLINENOALCOHOLCAPS,Patients with documentation Central Line (order or doc) and no documentation of a  alcohol caps on injection ports,2,{CENTRALLINEORDERORDOC} AND {CENTRALLINEALCOHOLCAPS}.COUNT = 0,,0,0,26977162,  02/12/19,0,1420973774
166439533,Documentation of Morbid Obesity without Dx,DOCUMENTATIONOFMORBIDOBESITYWITHOUTDX,Documentation of Morbid Obesity and no documentation of rejection.,2,{BMIMORBIDOBESITY} AND {MORBIDOBESITYDXREJECTED}.count =0 AND {MORBIDOBESITYDIAGNOSIS}.count = 0,,0,0,29858000,  02/15/19,0,1435823427
166440358,Morbid Obesity DX Rejected,MORBIDOBESITYDXREJECTED,Rejected Morbid Obesity Diagnosis,1,,,1,0,29858000,  02/15/19,0,1435823427
166441474,Morbid Obesity Diagnosis,MORBIDOBESITYDIAGNOSIS,Patients with an Morbid Obesity Diagnosis,1,,,1,0,29858000,  02/15/19,0,1435823427
181128822,Restricted Visitors,RESTRICTEDVISITORS,An encounter that has Restrict Visitors DTA marked as yes.,1,,,1,0,28997562,  04/01/19,0,1624733277
181129183,IOPOC Required and Not Documented,IOPOCREQUIREDANDNOTDOCUMENTED,Rehab encounters with no IOPOC note documented,2,"{IOPOCDOCUMENTED}.COUNT = 0 AND {MEDICALSERVICE}.VALUE = ""REHPHYSICALREHAB""",,0,0,28997562,  04/01/19,0,1624733277
192658558,QM - Antipsychotic Justification Combo,QMANTIPSYCHOTICJUSTIFICATIONCOMBO,Documentation of a history of a minimum of three failed multiple trials of monotherapy and a recommended plan to taper to monotherapy,1,,,1,0,26977162,  05/06/19,0,1780198323
243999244,Handoff Report Checklist Completed in Past One Hour,HANDOFFREPORTCHECKLISTCOMPLETEDINPASTONEHOUR,Encounters for which 'Handoff Report Checklist' documentation has been completed in past one hour,2,{HANDOFFREPORTCHECKLISTCOMPLETED}.COUNT > 0 AND {HANDOFFREPORTCHECKLISTCOMPLETED}.AGE < 60,,0,0,26807360,  07/25/19,0,3402469
251260857,BP Time Out Complete,BPTIMEOUTCOMPLETE,BP Time Out documentation complete as indicated by documentation of required elements: Bedside Procedure Time Out,1,,"1,H",1,0,28456740,  08/05/19,0,57869437
251262589,BP Type Lumbar Puncture,BPTYPELUMBARPUNCTURE,Pre-verification Procedure Type = Lumbar Puncture,1,,"1,H",1,0,26807360,  08/11/20,1,1726517133
251287819,BP Type Other,BPTYPEOTHER,Pre-verification Procedure Type = Other,1,,"1,H",1,0,26807360,  08/11/20,2,1726517133
251288530,BP Type PICC Line Insertion,BPTYPEPICCLINEINSERTION,Pre-verification Procedure Type = PICC line insertion,1,,"1,H",1,0,26807360,  08/11/20,1,1726517133
251289084,BP Type Midline Insertion,BPTYPEMIDLINEINSERTION,Pre-verification Procedure Type = Midline insertion,1,,"1,H",1,0,26807360,  08/11/20,1,1726517133
295258500,BP Type Arterial Line Insertion and has NO Order,BPTYPEARTERIALLINEINSERTIONANDHASNOORDER,Pre-verification Procedure Type = Arterial line insertion insertion AND no active or complete order for Arterial line insertion,2,{BPTYPEARTERIALLINEINSERTION}.COUNT > 0 AND ({ARTERIALLINEINSERTIONORDER}.COUNT + {BPDOCUMENTEDARTERIALLINEINSERTION}.COUNT = 0),,0,0,26807360,  08/11/20,3,1726517133
300720348,Suicide Risk,SUICIDERISK,Patients that qualify at risk for suicide,1,,,1,0,26977162,  10/15/19,0,407330062
301664306,Heparin Protocol Advisor VTE/PE,HEPARINPROTOCOLADVISORVTEPE,Patient is on the Heparin Protocol Advisor VTE/PE,2,"{HEPARINPROTOCOLADVISOR}.VALUE=""Heparin Protocol - VTE/PE""",,0,0,29478950,  10/16/19,0,413787851
302253173,No Hepatitis B Vaccine,NOHEPATITISBVACCINE,Patient's that do not have a Hepatitis B vaccine order on the current encounter.,2,{HEPATITISBVACCINE}.count = 0,,0,0,29242259,  10/17/19,0,418045271
